{
  "$schema": "https://json-schema.org/draft/2020-12/schema",
  "$id": "https://perfeng.dev/schemas/run-metadata.schema.json",
  "title": "Performance Run Metadata",
  "description": "Complete metadata for a single performance test run",
  "type": "object",
  "required": ["run", "test", "candidate", "environment"],
  "additionalProperties": false,
  "properties": {
    "run": {
      "type": "object",
      "required": ["id", "suite", "profile", "timestamp", "trigger", "status"],
      "additionalProperties": false,
      "properties": {
        "id": {
          "type": "string",
          "pattern": "^perf-[0-9]{8}-[0-9]{6}-[a-f0-9]{8}$",
          "description": "Unique performance run identifier"
        },
        "suite": {
          "type": "string",
          "minLength": 1,
          "description": "Test suite name (e.g., checkout-api, search-flow)"
        },
        "profile": {
          "type": "string",
          "enum": [
            "smoke",
            "average",
            "regression",
            "stress",
            "capacity",
            "soak"
          ],
          "description": "Workload profile used"
        },
        "timestamp": {
          "type": "string",
          "format": "date-time",
          "description": "Run start timestamp in ISO 8601"
        },
        "trigger": {
          "type": "string",
          "enum": ["manual", "ci", "schedule", "bisect", "release"],
          "description": "What triggered this run"
        },
        "status": {
          "type": "string",
          "enum": [
            "CREATED",
            "VALIDATING",
            "PROVISIONING",
            "WARMING_UP",
            "RUNNING",
            "COLLECTING",
            "ANALYZING",
            "REPORTING",
            "COMPLETED",
            "INVALID",
            "ABORTED",
            "INFRASTRUCTURE_FAILURE",
            "TEST_FAILURE",
            "INCONCLUSIVE"
          ],
          "description": "Current run state"
        },
        "policyVersion": {
          "type": ["string", "null"],
          "default": null,
          "description": "Version of the policy used for evaluation"
        },
        "notes": {
          "type": ["string", "null"],
          "default": null,
          "maxLength": 1000,
          "description": "Optional notes about this run"
        }
      }
    },
    "test": {
      "type": "object",
      "required": ["type", "tool", "toolVersion", "scenario"],
      "additionalProperties": false,
      "properties": {
        "type": {
          "type": "string",
          "enum": ["api", "browser", "kubernetes", "infrastructure"],
          "description": "Type of performance test"
        },
        "tool": {
          "type": "string",
          "enum": ["k6", "playwright", "kube-burner", "benchmark-operator"],
          "description": "Tool used for testing"
        },
        "toolVersion": {
          "type": "string",
          "minLength": 1,
          "description": "Version of the test tool"
        },
        "scenario": {
          "type": "string",
          "minLength": 1,
          "description": "Specific scenario name"
        },
        "workloadVersion": {
          "type": ["string", "null"],
          "default": null,
          "description": "Version of the workload definition"
        },
        "configHash": {
          "type": ["string", "null"],
          "default": null,
          "description": "Hash of the test configuration"
        }
      }
    },
    "candidate": {
      "type": "object",
      "required": ["gitSha"],
      "additionalProperties": false,
      "properties": {
        "gitSha": {
          "type": "string",
          "pattern": "^[A-Fa-f0-9]{40}$",
          "description": "Git commit SHA of the candidate"
        },
        "imageDigest": {
          "type": ["string", "null"],
          "default": null,
          "description": "Container image digest"
        },
        "version": {
          "type": ["string", "null"],
          "default": null,
          "description": "Application version string"
        },
        "branch": {
          "type": ["string", "null"],
          "default": null,
          "description": "Git branch name"
        },
        "configurationHash": {
          "type": ["string", "null"],
          "default": null,
          "description": "Hash of application configuration"
        },
        "featureFlags": {
          "type": ["object", "null"],
          "default": null,
          "description": "Feature flag settings",
          "additionalProperties": {
            "type": ["string", "boolean", "number", "null"]
          }
        },
        "databaseMigrationVersion": {
          "type": ["string", "null"],
          "default": null,
          "description": "Database migration version"
        }
      }
    },
    "environment": {
      "type": "object",
      "required": ["cluster", "kubernetesVersion"],
      "additionalProperties": false,
      "properties": {
        "cluster": {
          "type": "string",
          "minLength": 1,
          "description": "Cluster name"
        },
        "kubernetesVersion": {
          "type": "string",
          "pattern": "^v?\\d+\\.\\d+\\.\\d+",
          "description": "Kubernetes version"
        },
        "nodePool": {
          "type": ["string", "null"],
          "default": null,
          "description": "Node pool identifier"
        },
        "nodeModel": {
          "type": ["string", "null"],
          "default": null,
          "description": "Node hardware model"
        },
        "cpuArchitecture": {
          "type": ["string", "null"],
          "default": null,
          "pattern": "^(amd64|arm64)$",
          "description": "CPU architecture (e.g., amd64, arm64)"
        },
        "kernel": {
          "type": ["string", "null"],
          "default": null,
          "description": "Kernel version"
        },
        "containerRuntime": {
          "type": ["string", "null"],
          "default": null,
          "description": "Container runtime (containerd, cri-o, etc.)"
        },
        "cni": {
          "type": ["string", "null"],
          "default": null,
          "description": "Container Network Interface"
        },
        "storageClass": {
          "type": ["string", "null"],
          "default": null,
          "description": "Storage class used"
        },
        "fingerprint": {
          "type": ["string", "null"],
          "default": null,
          "pattern": "^[a-f0-9]{64}$",
          "description": "Canonical environment fingerprint"
        },
        "nodeCount": {
          "type": ["integer", "null"],
          "default": null,
          "minimum": 1,
          "description": "Number of nodes"
        },
        "region": {
          "type": ["string", "null"],
          "default": null,
          "description": "Geographic region"
        }
      }
    },
    "runtime": {
      "type": ["object", "null"],
      "default": null,
      "description": "Runtime resource configuration",
      "additionalProperties": false,
      "properties": {
        "replicas": {
          "type": ["integer", "null"],
          "default": null,
          "minimum": 1,
          "description": "Number of replicas"
        },
        "cpuRequests": {
          "type": ["string", "null"],
          "default": null,
          "pattern": "^\\d+(\\.\\d+)?m?$",
          "description": "CPU requests (e.g., '500m')"
        },
        "cpuLimits": {
          "type": ["string", "null"],
          "default": null,
          "pattern": "^\\d+(\\.\\d+)?m?$",
          "description": "CPU limits"
        },
        "memoryRequests": {
          "type": ["string", "null"],
          "default": null,
          "pattern": "^\\d+(\\.\\d+)?(Ki|Mi|Gi|Ti|K|M|G|T)?$",
          "description": "Memory requests (e.g., '512Mi')"
        },
        "memoryLimits": {
          "type": ["string", "null"],
          "default": null,
          "pattern": "^\\d+(\\.\\d+)?(Ki|Mi|Gi|Ti|K|M|G|T)?$",
          "description": "Memory limits"
        },
        "hpa": {
          "type": ["object", "null"],
          "default": null,
          "description": "Horizontal Pod Autoscaler configuration",
          "additionalProperties": false,
          "properties": {
            "enabled": {
              "type": ["boolean", "null"],
              "default": null
            },
            "minReplicas": {
              "type": ["integer", "null"],
              "default": null,
              "minimum": 1
            },
            "maxReplicas": {
              "type": ["integer", "null"],
              "default": null,
              "minimum": 1
            },
            "targetCpuUtilization": {
              "type": ["integer", "null"],
              "default": null,
              "minimum": 1,
              "maximum": 100
            }
          }
        }
      }
    },
    "data": {
      "type": ["object", "null"],
      "default": null,
      "description": "Test data information",
      "additionalProperties": false,
      "properties": {
        "datasetId": {
          "type": ["string", "null"],
          "default": null,
          "description": "Dataset identifier"
        },
        "datasetVersion": {
          "type": ["string", "null"],
          "default": null,
          "description": "Dataset version"
        },
        "databaseSize": {
          "type": ["string", "null"],
          "default": null,
          "pattern": "^\\d+(\\.\\d+)?(KB|MB|GB|TB|KiB|MiB|GiB|TiB)$",
          "description": "Database size (e.g., '10GB')"
        },
        "seedVersion": {
          "type": ["string", "null"],
          "default": null,
          "description": "Data seed version"
        }
      }
    },
    "phases": {
      "type": ["object", "null"],
      "default": null,
      "description": "Timing information for different phases",
      "additionalProperties": false,
      "properties": {
        "provisionStart": {
          "type": ["string", "null"],
          "default": null,
          "format": "date-time"
        },
        "warmupStart": {
          "type": ["string", "null"],
          "default": null,
          "format": "date-time"
        },
        "measurementStart": {
          "type": ["string", "null"],
          "default": null,
          "format": "date-time"
        },
        "measurementEnd": {
          "type": ["string", "null"],
          "default": null,
          "format": "date-time"
        },
        "cooldownEnd": {
          "type": ["string", "null"],
          "default": null,
          "format": "date-time"
        }
      }
    }
  }
}
